{
  "frontend": "cose-tp-json/v1",
  "combinator": "and",
  "message": {
    "fact": "content-type/v1",
    "predicate": { "matches": "application/cose" }
  },
  "primary_signing_key": {
    "all_of": [
      { "fact": "x509-chain-trusted/v1",         "predicate": { "is_trusted": true } },
      { "fact": "x509-cert-identity-allowed/v1", "predicate": { "is_allowed": true } }
    ]
  },
  "any_counter_signature": {
    "on_empty": "deny",
    "fact": "mst-receipt-trusted/v1",
    "predicate": { "is_trusted": true }
  }
}
